task,idx,intent,metric,acc_val_mean,stability_std,test,flops,gflops,wall_ms,on_frontier
colored_mnist,8,"Improve generalization and held-out accuracy by adding label smoothing in the loss, replacing LeakyReLU with GELU activations for smoother gradients, and slightly increasing training epochs with the existing augmentation and model.",accuracy,0.987867,0.001592,0.965500,3875558400000,3875.5584,23700.9,1
colored_mnist,6,"Enhance the existing CNN by adding a third convolutional block with batch normalization and dropout, increasing model capacity moderately, and introducing mild random affine data augmentation during training to improve generalization and held-out accuracy.",accuracy,0.979067,0.002565,0.951500,3229632000000,3229.6320,18872.5,1
colored_mnist,4,"Improve generalization and accuracy by adding dropout, using LeakyReLU activations, and increasing epochs with a cosine annealing learning rate scheduler.",accuracy,0.978933,0.001738,0.936500,1809112320000,1809.1123,12703.7,1
colored_mnist,1,"Replace the linear classifier with a small convolutional neural network using normalization, ReLU activations, Adam optimizer, and more epochs to improve accuracy.",accuracy,0.977200,0.000558,0.936000,1206074880000,1206.0749,7729.9,1
colored_mnist,2,Add simple data augmentation (random horizontal flips and random crops) plus label smoothing in the loss to improve generalization and held-out accuracy.,accuracy,0.946133,0.012939,0.878000,1809112320000,1809.1123,13801.9,0
colored_mnist,0,baseline,accuracy,0.827067,0.003483,0.091500,1270080000,1.2701,16.5,1
colored_mnist,3,"Add Mixup data augmentation, increase model capacity slightly, and use cosine annealing LR scheduler to improve generalization and held-out accuracy.",accuracy,-1000000.000000,0.000000,-1000000.000000,-1,-0.0000,0.0,0
colored_mnist,5,"Enhance the convolutional network by adding an additional convolutional block, using ELU activations, label smoothing, and MixUp data augmentation with a small increase in training epochs to improve generalization and held-out accuracy.",accuracy,-1000000.000000,0.000000,-1000000.000000,-1,-0.0000,0.0,0
colored_mnist,7,"Improve accuracy by adding MixUp data augmentation combined with the existing mild random affine transforms, switching to ELU activations for smoother gradients, adding weight normalization for faster convergence, and increasing training epochs slightly with a cosine annealing warm restart scheduler",accuracy,-1000000.000000,0.000000,-1000000.000000,-1,-0.0000,0.0,0
